{
  "emitter_id": "CARMONEY",
  "name": "ПАО «КарМани»",
  "inn": "7719451419",
  "industry_group": 2,
  "report_request": {
    "period_type": "annual",
    "period": "2025",
    "reporting_standard": "rsbu",
    "need_notes": true,
    "need_cashflow": true,
    "need_prev_period": true,
    "allow_ifrs_fallback": false
  },
  "source_hints": {
    "edisclosure_company_id": "8657",
    "edisclosure_url": "https://www.e-disclosure.ru/portal/company.aspx?id=8657",
    "preferred_document_types": [
      "accounting_report",
      "notes"
    ]
  }
}